[
  {
    "field_id": "FLD_GENERAL",
    "field_name": "General Field",
    "field_abbreviation": "GEN",
    "field_description": "General across all genres: Album, Record, Song of the Year, Best New Artist",
    "inaugural_ceremony_edition": 1,
    "current_active_status": true,
    "active_categories_count": 4,
    "specialist_committee_jurisdiction": "General Field Screening Committee",
    "field_curator_role": "Trustee Committee Chairperson",
    "last_bylaw_revision_year": 2023
  },
  {
    "field_id": "FLD_POP",
    "field_name": "Pop & Dance/Electronic",
    "field_abbreviation": "POP",
    "field_description": "Mainstream and contemporary pop recordings",
    "inaugural_ceremony_edition": 10,
    "current_active_status": true,
    "active_categories_count": 8,
    "specialist_committee_jurisdiction": "Pop & Dance/Electronic Screening Committee",
    "field_curator_role": "Trustee Committee Chairperson",
    "last_bylaw_revision_year": 2023
  },
  {
    "field_id": "FLD_ROCK",
    "field_name": "Rock, Metal & Alternative",
    "field_abbreviation": "RCK",
    "field_description": "Rock, hard rock, heavy metal and alternative compositions",
    "inaugural_ceremony_edition": 10,
    "current_active_status": true,
    "active_categories_count": 8,
    "specialist_committee_jurisdiction": "Rock, Metal & Alternative Screening Committee",
    "field_curator_role": "Trustee Committee Chairperson",
    "last_bylaw_revision_year": 2023
  },
  {
    "field_id": "FLD_R_AND_B",
    "field_name": "R&B, Rap & Spoken Word",
    "field_abbreviation": "RNB",
    "field_description": "Rhythm and blues, hip hop, rap performance",
    "inaugural_ceremony_edition": 10,
    "current_active_status": true,
    "active_categories_count": 8,
    "specialist_committee_jurisdiction": "R&B, Rap & Spoken Word Screening Committee",
    "field_curator_role": "Trustee Committee Chairperson",
    "last_bylaw_revision_year": 2023
  },
  {
    "field_id": "FLD_COUNTRY",
    "field_name": "Country & American Roots",
    "field_abbreviation": "CTY",
    "field_description": "Country, bluegrass, folk and Americana traditions",
    "inaugural_ceremony_edition": 10,
    "current_active_status": true,
    "active_categories_count": 8,
    "specialist_committee_jurisdiction": "Country & American Roots Screening Committee",
    "field_curator_role": "Trustee Committee Chairperson",
    "last_bylaw_revision_year": 2023
  },
  {
    "field_id": "FLD_JAZZ",
    "field_name": "Jazz, Traditional & Instrumental",
    "field_abbreviation": "JAZ",
    "field_description": "Improvised instrumental and vocal jazz recordings",
    "inaugural_ceremony_edition": 10,
    "current_active_status": true,
    "active_categories_count": 8,
    "specialist_committee_jurisdiction": "Jazz, Traditional & Instrumental Screening Committee",
    "field_curator_role": "Trustee Committee Chairperson",
    "last_bylaw_revision_year": 2023
  },
  {
    "field_id": "FLD_CLASSICAL",
    "field_name": "Classical",
    "field_abbreviation": "CLA",
    "field_description": "Symphonic, operatic, choral and chamber music",
    "inaugural_ceremony_edition": 10,
    "current_active_status": true,
    "active_categories_count": 8,
    "specialist_committee_jurisdiction": "Classical Screening Committee",
    "field_curator_role": "Trustee Committee Chairperson",
    "last_bylaw_revision_year": 2023
  },
  {
    "field_id": "FLD_VISUAL_MEDIA",
    "field_name": "Music for Visual Media",
    "field_abbreviation": "VIS",
    "field_description": "Soundtrack scores, compilation scores, music for films and video games",
    "inaugural_ceremony_edition": 10,
    "current_active_status": true,
    "active_categories_count": 8,
    "specialist_committee_jurisdiction": "Music for Visual Media Screening Committee",
    "field_curator_role": "Trustee Committee Chairperson",
    "last_bylaw_revision_year": 2023
  },
  {
    "field_id": "FLD_LATIN",
    "field_name": "Latin, Global & Reggae",
    "field_abbreviation": "LAT",
    "field_description": "Latin pop, urban, tropical, and world music recordings",
    "inaugural_ceremony_edition": 10,
    "current_active_status": true,
    "active_categories_count": 8,
    "specialist_committee_jurisdiction": "Latin, Global & Reggae Screening Committee",
    "field_curator_role": "Trustee Committee Chairperson",
    "last_bylaw_revision_year": 2023
  },
  {
    "field_id": "FLD_CRAFT",
    "field_name": "Production, Engineering & Composition",
    "field_abbreviation": "CRF",
    "field_description": "Audio engineering, mastering, arranging, package artwork",
    "inaugural_ceremony_edition": 10,
    "current_active_status": true,
    "active_categories_count": 8,
    "specialist_committee_jurisdiction": "Production, Engineering & Composition Screening Committee",
    "field_curator_role": "Trustee Committee Chairperson",
    "last_bylaw_revision_year": 2023
  },
  {
    "field_id": "FLD_GENERAL_11",
    "field_name": "General Field Division 11",
    "field_abbreviation": "GEN",
    "field_description": "General across all genres: Album, Record, Song of the Year, Best New Artist",
    "inaugural_ceremony_edition": 1,
    "current_active_status": true,
    "active_categories_count": 4,
    "specialist_committee_jurisdiction": "General Field Screening Committee",
    "field_curator_role": "Trustee Committee Chairperson",
    "last_bylaw_revision_year": 2023
  },
  {
    "field_id": "FLD_POP_12",
    "field_name": "Pop & Dance/Electronic Division 12",
    "field_abbreviation": "POP",
    "field_description": "Mainstream and contemporary pop recordings",
    "inaugural_ceremony_edition": 10,
    "current_active_status": true,
    "active_categories_count": 8,
    "specialist_committee_jurisdiction": "Pop & Dance/Electronic Screening Committee",
    "field_curator_role": "Trustee Committee Chairperson",
    "last_bylaw_revision_year": 2023
  },
  {
    "field_id": "FLD_ROCK_13",
    "field_name": "Rock, Metal & Alternative Division 13",
    "field_abbreviation": "RCK",
    "field_description": "Rock, hard rock, heavy metal and alternative compositions",
    "inaugural_ceremony_edition": 10,
    "current_active_status": true,
    "active_categories_count": 8,
    "specialist_committee_jurisdiction": "Rock, Metal & Alternative Screening Committee",
    "field_curator_role": "Trustee Committee Chairperson",
    "last_bylaw_revision_year": 2023
  },
  {
    "field_id": "FLD_R_AND_B_14",
    "field_name": "R&B, Rap & Spoken Word Division 14",
    "field_abbreviation": "RNB",
    "field_description": "Rhythm and blues, hip hop, rap performance",
    "inaugural_ceremony_edition": 10,
    "current_active_status": true,
    "active_categories_count": 8,
    "specialist_committee_jurisdiction": "R&B, Rap & Spoken Word Screening Committee",
    "field_curator_role": "Trustee Committee Chairperson",
    "last_bylaw_revision_year": 2023
  },
  {
    "field_id": "FLD_COUNTRY_15",
    "field_name": "Country & American Roots Division 15",
    "field_abbreviation": "CTY",
    "field_description": "Country, bluegrass, folk and Americana traditions",
    "inaugural_ceremony_edition": 10,
    "current_active_status": true,
    "active_categories_count": 8,
    "specialist_committee_jurisdiction": "Country & American Roots Screening Committee",
    "field_curator_role": "Trustee Committee Chairperson",
    "last_bylaw_revision_year": 2023
  },
  {
    "field_id": "FLD_JAZZ_16",
    "field_name": "Jazz, Traditional & Instrumental Division 16",
    "field_abbreviation": "JAZ",
    "field_description": "Improvised instrumental and vocal jazz recordings",
    "inaugural_ceremony_edition": 10,
    "current_active_status": true,
    "active_categories_count": 8,
    "specialist_committee_jurisdiction": "Jazz, Traditional & Instrumental Screening Committee",
    "field_curator_role": "Trustee Committee Chairperson",
    "last_bylaw_revision_year": 2023
  },
  {
    "field_id": "FLD_CLASSICAL_17",
    "field_name": "Classical Division 17",
    "field_abbreviation": "CLA",
    "field_description": "Symphonic, operatic, choral and chamber music",
    "inaugural_ceremony_edition": 10,
    "current_active_status": true,
    "active_categories_count": 8,
    "specialist_committee_jurisdiction": "Classical Screening Committee",
    "field_curator_role": "Trustee Committee Chairperson",
    "last_bylaw_revision_year": 2023
  },
  {
    "field_id": "FLD_VISUAL_MEDIA_18",
    "field_name": "Music for Visual Media Division 18",
    "field_abbreviation": "VIS",
    "field_description": "Soundtrack scores, compilation scores, music for films and video games",
    "inaugural_ceremony_edition": 10,
    "current_active_status": true,
    "active_categories_count": 8,
    "specialist_committee_jurisdiction": "Music for Visual Media Screening Committee",
    "field_curator_role": "Trustee Committee Chairperson",
    "last_bylaw_revision_year": 2023
  },
  {
    "field_id": "FLD_LATIN_19",
    "field_name": "Latin, Global & Reggae Division 19",
    "field_abbreviation": "LAT",
    "field_description": "Latin pop, urban, tropical, and world music recordings",
    "inaugural_ceremony_edition": 10,
    "current_active_status": true,
    "active_categories_count": 8,
    "specialist_committee_jurisdiction": "Latin, Global & Reggae Screening Committee",
    "field_curator_role": "Trustee Committee Chairperson",
    "last_bylaw_revision_year": 2023
  },
  {
    "field_id": "FLD_CRAFT_20",
    "field_name": "Production, Engineering & Composition Division 20",
    "field_abbreviation": "CRF",
    "field_description": "Audio engineering, mastering, arranging, package artwork",
    "inaugural_ceremony_edition": 10,
    "current_active_status": true,
    "active_categories_count": 8,
    "specialist_committee_jurisdiction": "Production, Engineering & Composition Screening Committee",
    "field_curator_role": "Trustee Committee Chairperson",
    "last_bylaw_revision_year": 2023
  },
  {